{
  "schema_version": 1,
  "module_id": "checker",
  "purpose": "Execute stdin instructions against the input stacks and report OK, KO, or Error.",
  "paths": [
    {"path": "cmd/checker/main.go", "lifecycle": "implemented", "provenance": "authored"}
  ],
  "contracts": [],
  "validators": [],
  "tests": ["tests/integration_test.go"],
  "runtime_evidence": []
}
